<?xml version="1.0" encoding="UTF-8"?>
<product_allergen_information_module:productAllergenInformationModule xmlns:product_allergen_information_module="urn:gs1:tsd:product_allergen_information_module:xsd:1" xmlns:shared_common="urn:gs1:shared:shared_common:xsd:3" xmlns:tsd_common="urn:gs1:tsd:tsd_common:xsd:1" xmlns:xsi="http://www.w3.org/2001/XMLSchema-instance" xsi:schemaLocation="urn:gs1:tsd:product_allergen_information_module:xsd:1 ProductAllergenInformationModule.xsd ">
  <allergenRelatedInformation>
    <allergenStatement languageCode="en">allergenStatement</allergenStatement>
    <allergenSpecificationAgency>allergenSpecificationAgency</allergenSpecificationAgency>
    <allergenSpecificationName>allergenSpecificationName</allergenSpecificationName>
    <allergen>
      <allergenTypeCode>allergenTypeCode</allergenTypeCode>
      <levelOfContainmentCode>levelOfContainmentCode</levelOfContainmentCode>
    </allergen>
  </allergenRelatedInformation>
</product_allergen_information_module:productAllergenInformationModule>
